{"address":"nolus1lease0000000000000000000000000000000long","protocol":"OSMOSIS-OSMOSIS-ALL_BTC","status":"opened","amount":{"ticker":"ALL_BTC","amount":"100000000","amount_usd":"63463.43"},"debt":{"ticker":"USDC_NOBLE","principal":"20000000000","overdue_margin":"0","overdue_interest":"0","due_margin":"1500000","due_interest":"2500000","total":"20004000000","total_usd":"20004.00"},"interest":{"loan_rate":120,"margin_rate":40,"annual_rate_percent":16},"pnl":{"amount":"1234.56","percent":"6.17","downpayment":"20000.00","pnl_positive":true},"liquidation_price":"48000.123456"}
